Категория;Товар;Поисковые метки;Цена;Цена оптовая;Адрес;Видим;Рекомендуемый;Бренд;Вариант;Старая цена;Артикул;Склад;Заголовок страницы;Ключевые слова;Описание страницы;Аннотация;Описание;Изображения;Производитель;Емкость;Тип масла;Тип двигателя;SAE (Вязкость);Применение;ACEA;API;ILSAC;DEXTRON;JASO;ISO;CCMC;CIK-FIA;NMMA;Класс вязкости;Тип фильтра;Функция;Модель;Высота H1 (mm);Высота H2 (mm);Диаметр внешний OD1 (mm);Диаметр внешний OD2 (mm);Диаметр внутренний ID1 (mm);Диаметр внутренний ID2 (mm);Резьба (?);Нижняя резьба (?);Наруж. диаметр прокладки OD2 (mm);Внутр. диаметр прокладки ID2 (mm);Тип колодки;Передний/Задний;Тип диска;Кол-во отверстий;Диаметр (mm) ;Диаметр фаски (mm);Длина L1 (mm);Длина L2 (mm);Ширина W1 (mm);Ширина W2 (mm);Толщина (мм);Высота (mm);Тип радиатора;Модель автомобиля;Размеры радиатора (mm);Впускной диаметр (mm);Выпускной диаметр (mm);Впускной диаметр (?);Выпускной диаметр (?);Комплект (шт);Материал;Примечание
"";"BMW ATF 3 AUTOMATIK- GETRIEBEOL";;0.01;;;"1";;;"Объем 1л";;;;;;;"<p><img src=/files/uploads/oil-cange.jpg width="179" height="130"/><img src=/files/uploads/104967w640_h640.jpg width="293" height="130" /></p><p><span style="font-family: arial, helvetica, sans-serif "><strong><span style="font-size: small "><div class="left"><h3>Трансмиссионное масло BMW ATF 3 Automatik-Getriebeol</h3> <div class="product-description"><p>Трансмиссионное масло <strong>BMW ATF 3 Automatik-Getriebeol</strong> применяется в восьмиступенчатых АКПП производства немецкого концерна ZF: GA8HP45Z - ZF 8HP45- GA8HP55Z - ZF 8HP55A- GA8HP70Z - ZF 8HP70.</p></span></strong></span></p>";"<div class="left"><h3>Трансмиссионное масло BMW ATF 3 Automatik-Getriebeol</h3> <div class="product-description"><p>Трансмиссионное масло <strong>BMW ATF 3 Automatik-Getriebeol</strong> применяется в восьмиступенчатых АКПП производства немецкого концерна ZF: GA8HP45Z - ZF 8HP45- GA8HP55Z - ZF 8HP55A- GA8HP70Z - ZF 8HP70.</p><h3>Преимущества</h3><ul><li>обладает отличными низкотемпературными свойствами</li><li>обеспечивает топливную экономичность</li><li>надёжно смазывает восьмиступенчатые автоматы устанавливаемые на автомобили BMW последних моделей</li><li>заменяет жидкость предыдущего поколения BMW ATF L 12108 оригинальный номер которой 83222152426</li></ul><div class="right"><ul class="product-benefit">";bmw_atf3_1l.jpg;BMW;;"";;"";;;;;;;;;;;;;;;;;;;;;;;;;;;;;;;;;;;;;;;;;;;;;;
"";"BMW ATF 3 AUTOMATIK- GETRIEBEOL";;0.01;;;"1";;;"Объем 1л";;;;;;;"<p><img src=/files/uploads/oil-cange.jpg width="179" height="130"/><img src=/files/uploads/104967w640_h640.jpg width="293" height="130" /></p><p><span style="font-family: arial, helvetica, sans-serif "><strong><span style="font-size: small "><div class="left"><h3>Трансмиссионное масло BMW ATF 3 Automatik-Getriebeol</h3> <div class="product-description"><p>Трансмиссионное масло <strong>BMW ATF 3 Automatik-Getriebeol</strong> применяется в восьмиступенчатых АКПП производства немецкого концерна ZF: GA8HP45Z - ZF 8HP45- GA8HP55Z - ZF 8HP55A- GA8HP70Z - ZF 8HP70.</p></span></strong></span></p>";"<div class="left"><h3>Трансмиссионное масло BMW ATF 3 Automatik-Getriebeol</h3> <div class="product-description"><p>Трансмиссионное масло <strong>BMW ATF 3 Automatik-Getriebeol</strong> применяется в восьмиступенчатых АКПП производства немецкого концерна ZF: GA8HP45Z - ZF 8HP45- GA8HP55Z - ZF 8HP55A- GA8HP70Z - ZF 8HP70.</p><h3>Преимущества</h3><ul><li>обладает отличными низкотемпературными свойствами</li><li>обеспечивает топливную экономичность</li><li>надёжно смазывает восьмиступенчатые автоматы устанавливаемые на автомобили BMW последних моделей</li><li>заменяет жидкость предыдущего поколения BMW ATF L 12108 оригинальный номер которой 83222152426</li></ul><div class="right"><ul class="product-benefit">";bmw_atf3_1l.jpg;BMW;;"";;"";;;;;;;;;;;;;;;;;;;;;;;;;;;;;;;;;;;;;;;;;;;;;;
"";"BMW ATF D2";;0.01;;;"1";;;"Объем 1л";;;;;;;"<p><img src=/files/uploads/oil-cange.jpg width="179" height="130"/><img src=/files/uploads/104967w640_h640.jpg width="293" height="130" /></p><p><span style="font-family: arial, helvetica, sans-serif "><strong><span style="font-size: small "><div class="left"><h3>Трансмиссионное масло BMW ATF 2 D2</h3> <div class="product-description"><p><strong>BMW ATF D2</strong> - оригинальная гидравлическая жидкость многофункционального типа, предназначенная для АКПП и ГУР (сервоприводов). Разработана специально для автомобилей марки BMW. Данная гидравлическая жидкость предназначена для гидравлических сцеплений и атоматических трансмиссий, для которых рекомендованы автоматические трансмиссионные жидкости ATF (тип Dexron II). Она гарантирует мягкую и бесперебойную работу гидравлических приводов независимо от условий эксплуатации. Отлично подходит для всех узлов, работающих в крайне тяжелых условиях.</p></span></strong></span></p>";"<div class="left"><h3>Трансмиссионное масло BMW ATF 2 D2</h3> <div class="product-description"><p><strong>BMW ATF D2</strong> - оригинальная гидравлическая жидкость многофункционального типа, предназначенная для АКПП и ГУР (сервоприводов). Разработана специально для автомобилей марки BMW. Данная гидравлическая жидкость предназначена для гидравлических сцеплений и атоматических трансмиссий, для которых рекомендованы автоматические трансмиссионные жидкости ATF (тип Dexron II). Она гарантирует мягкую и бесперебойную работу гидравлических приводов независимо от условий эксплуатации. Отлично подходит для всех узлов, работающих в крайне тяжелых условиях.</p><h3>Как выбрать трансмиссионное масло</h3><p style="font-size: 13px  line-height: 20.8px ">Трансмиссионными называют масла, специально предназначенные для механических коробок передач и ведущих мостов. Их общая особенность - способность создавать прочную смазывающую пленку, выдерживающую большие нагрузки в контакте деталей.  <span style="line-height: 20.8px ">Сегодня на рынке доступно великое множество различных масел. Но как выбрать, то что нужно именно вашему автомобилю? Прежде всего следует обратиться к указаниям заводской инструкции по эксплуатации автомобиля и уже на основе этого выбирать нужный продукт. Важно помнить, что следует соблюдать все указанные спецификации и не использовать более низкие категории масел, так как это призведет к выходу  агрегата из строя.  </span>  </p><p style="font-size: 13px  line-height: 20.8px ">Важно знать что, для автоматических коробок не годится ни трансмиссионное, ни моторное. Эти устройства специфичны, для их работы требуется маловязкая жидкость, которую в международной практике принято называть ATF (Automatic Transmission Fluid). Что же касается обычных легковых и грузовых автомобилей с классической компоновкой, а также полноприводных и некоторых переднеприводных, то в их агрегатах используются исключительно трансмиссионные масла.</p><p style="font-size: 13px  line-height: 20.8px ">Выбор по уровням эксплуатационных свойств это еще не все. Важно также определиться с вязкостью смазочного материала. Система SAE определяет текучесть масел для трансмиссий и ведущих мостов :</p><ul style="font-size: 13px  line-height: 20.8px "><li>Зимние (70W, 75W, 80W, 85W) классы </li><li>Летние (80,85,90,110,140,250) классы </li></ul><div class="right"><ul class="product-benefit">";bmw_atf_d2.jpg;BMW;;"";;"";;;;;;;;;;;;;;;;;;;;;;;;;;;;;;;;;;;;;;;;;;;;;;
"";"BMW ATF DEXRON III";;0.01;;;"1";;;"Объем 1л";;;;;;;"<p><img src=/files/uploads/oil-cange.jpg width="179" height="130"/><img src=/files/uploads/104967w640_h640.jpg width="293" height="130" /></p><p><span style="font-family: arial, helvetica, sans-serif "><strong><span style="font-size: small "><div class="left"><div class="product-description"></div></span></strong></span></p>";"<div class="left"><div class="right"><ul class="product-benefit">";bmw_atf_d3.jpg;BMW;;"";;"";;;;;;;;;;;;;;;;;;;;;;;;;;;;;;;;;;;;;;;;;;;;;;
"";"BMW M TWINPOWER TURBO LONGLIFE-01 0W-40";;0.01;;;"1";;;"Объем 1л";;;;;;;"<p><img src=/files/uploads/oil-cange.jpg width="179" height="130"/><img src=/files/uploads/104967w640_h640.jpg width="293" height="130" /></p><p><span style="font-family: arial, helvetica, sans-serif "><strong><span style="font-size: small "><div class="left"><h3>МОТОРНОЕ МАСЛО BMW TWINPOWER TURBO. ОРИГИНАЛЬНАЯ ФОРМУЛА СКОРОСТИ.</h3> <div class="product-description"><p>Новая линейка масел BMW создана специально, чтобы удовлетворить все самые жесткие требования современных двигателей BMW. Новые масла BMW разработаные на основе самых последних достижений в области технологий производства моторных масел. Вся линейка охватывает потребности и учитывает особенности эксплуатации автомобилей BMW во многих уголках света. В том числе и страны с суровым климатом и нестабильным качеством топлива. В основе производства оригинальных моторных масел BMW лежит комплекс технологий GTL, который позволяет получать кристально чистые базовые масла из природного газа.</p></span></strong></span></p>";"<div class="left"><h3>МОТОРНОЕ МАСЛО BMW TWINPOWER TURBO. ОРИГИНАЛЬНАЯ ФОРМУЛА СКОРОСТИ.</h3> <div class="product-description"><p>Новая линейка масел BMW создана специально, чтобы удовлетворить все самые жесткие требования современных двигателей BMW. Новые масла BMW разработаные на основе самых последних достижений в области технологий производства моторных масел. Вся линейка охватывает потребности и учитывает особенности эксплуатации автомобилей BMW во многих уголках света. В том числе и страны с суровым климатом и нестабильным качеством топлива. В основе производства оригинальных моторных масел BMW лежит комплекс технологий GTL, который позволяет получать кристально чистые базовые масла из природного газа.</p><h3>Применение</h3><p>Моторное масло <strong>BMW M TwinPower Turbo Longlife-01  0W-40</strong> создано специально для двигателей BMW, а также для двигателей BMW M нового поколения. Благодаря применению инновационной технологии производства базовых масел GTL обеспечивается защита двигателя на уровне, превосходящем отраслевые стандарты. Это моторное масло поддерживает оптимальную чистоту двигателей BMW и BMW M и позволяет полностью использовать их потенциал.</p><p>Моторное масло прошло сложные испытания и допущено к использованию в двигателях BMW, а также в двигателях BMW M нового поколения. Данное моторное масло допущено концерном BMW к использованию как всесезонное.</p><p>Применять строго в соответствии с руководством по эксплуатации вашего автомобиля! Для бензиновых двигателей и дизелей BMW без сажевого фильтра. Для всех автомобилей <strong>BMW M</strong>, за исключением:   </p><ul><li>M5/M6 с датой выпуска до 2011 г.</li><li>M3 с датой выпуска до 2014 г.</li></ul><h3>Преимущества</h3><ul><li>Обеспечивает исключительные динамические качества двигателей BMW и BMW M.</li><li>Уверенный запуск двигателя при низких температурах.    </li><li>Превосходная защита от износа.</li><li>Запатентованная технология активной очистки защищает от образования отложений и коррозии, таким образом продлевая срок службы двигателей.</li></ul><div class="right"><ul class="product-benefit">";bmw_m_twin_power_turbo_0w40_ll-01_1l.jpg;BMW;;"";;"";;;;;;;;;;;;;;;;;;;;;;;;;;;;;;;;;;;;;;;;;;;;;;
"";"BMW M TWINPOWER TURBO LONGLIFE-01 0W-40";;0.01;;;"1";;;"Объем 1л";;;;;;;"<p><img src=/files/uploads/oil-cange.jpg width="179" height="130"/><img src=/files/uploads/104967w640_h640.jpg width="293" height="130" /></p><p><span style="font-family: arial, helvetica, sans-serif "><strong><span style="font-size: small "><div class="left"><h3>МОТОРНОЕ МАСЛО BMW TWINPOWER TURBO. ОРИГИНАЛЬНАЯ ФОРМУЛА СКОРОСТИ.</h3> <div class="product-description"><p>Новая линейка масел BMW создана специально, чтобы удовлетворить все самые жесткие требования современных двигателей BMW. Новые масла BMW разработаные на основе самых последних достижений в области технологий производства моторных масел. Вся линейка охватывает потребности и учитывает особенности эксплуатации автомобилей BMW во многих уголках света. В том числе и страны с суровым климатом и нестабильным качеством топлива. В основе производства оригинальных моторных масел BMW лежит комплекс технологий GTL, который позволяет получать кристально чистые базовые масла из природного газа.</p></span></strong></span></p>";"<div class="left"><h3>МОТОРНОЕ МАСЛО BMW TWINPOWER TURBO. ОРИГИНАЛЬНАЯ ФОРМУЛА СКОРОСТИ.</h3> <div class="product-description"><p>Новая линейка масел BMW создана специально, чтобы удовлетворить все самые жесткие требования современных двигателей BMW. Новые масла BMW разработаные на основе самых последних достижений в области технологий производства моторных масел. Вся линейка охватывает потребности и учитывает особенности эксплуатации автомобилей BMW во многих уголках света. В том числе и страны с суровым климатом и нестабильным качеством топлива. В основе производства оригинальных моторных масел BMW лежит комплекс технологий GTL, который позволяет получать кристально чистые базовые масла из природного газа.</p><h3>Применение</h3><p>Моторное масло <strong>BMW M TwinPower Turbo Longlife-01  0W-40</strong> создано специально для двигателей BMW, а также для двигателей BMW M нового поколения. Благодаря применению инновационной технологии производства базовых масел GTL обеспечивается защита двигателя на уровне, превосходящем отраслевые стандарты. Это моторное масло поддерживает оптимальную чистоту двигателей BMW и BMW M и позволяет полностью использовать их потенциал.</p><p>Моторное масло прошло сложные испытания и допущено к использованию в двигателях BMW, а также в двигателях BMW M нового поколения. Данное моторное масло допущено концерном BMW к использованию как всесезонное.</p><p>Применять строго в соответствии с руководством по эксплуатации вашего автомобиля! Для бензиновых двигателей и дизелей BMW без сажевого фильтра. Для всех автомобилей <strong>BMW M</strong>, за исключением:   </p><ul><li>M5/M6 с датой выпуска до 2011 г.</li><li>M3 с датой выпуска до 2014 г.</li></ul><h3>Преимущества</h3><ul><li>Обеспечивает исключительные динамические качества двигателей BMW и BMW M.</li><li>Уверенный запуск двигателя при низких температурах.    </li><li>Превосходная защита от износа.</li><li>Запатентованная технология активной очистки защищает от образования отложений и коррозии, таким образом продлевая срок службы двигателей.</li></ul><div class="right"><ul class="product-benefit">";bmw_m_twin_power_turbo_0w40_ll-01_1l.jpg;BMW;;"";;"";;;;;;;;;;;;;;;;;;;;;;;;;;;;;;;;;;;;;;;;;;;;;;
